{
  "version": "1.0",
  "id": "group-message-001",
  "type": "GROUP",
  "sender": "phone:+15550001001",
  "recipient": "group:example-group",
  "timestamp": "2026-09-12T12:02:00Z",
  "payload": {
    "text": "Hello everyone!",
    "group_id": "example-group",
    "members": [
      "phone:+15550001001",
      "phone:+15550001002",
      "phone:+15550001003"
    ]
  },
  "metadata": {},
  "security": {
    "encrypted": true,
    "ratchet": "message"
  }
}
