{
  "version": "1.0",
  "id": "encrypted-message-001",
  "type": "TEXT",
  "sender": "phone:+15550001001",
  "recipient": "phone:+15550001002",
  "timestamp": "2026-09-12T12:01:00Z",
  "payload": {
    "ciphertext": "BASE64_ENCODED_CIPHERTEXT",
    "nonce": "BASE64_ENCODED_NONCE",
    "algorithm": "AEAD"
  },
  "metadata": {},
  "security": {
    "encrypted": true,
    "ratchet": "message"
  }
}
